{
  "$schema": "https://json-schema.org/draft/2020-12/schema",
  "$id": "https://emuflow.dev/schema/boarddb-v1.schema.json",
  "title": "EmuFlow virtual/hardware BoardDB v1",
  "type": "object",
  "required": ["schema", "platform", "fpgas", "links"],
  "properties": {
    "schema": {"const": "emuflow.boarddb/v1"},
    "platform": {
      "type": "object",
      "required": ["name", "kind"],
      "properties": {
        "name": {"type": "string"},
        "kind": {"enum": ["virtual", "hardware"]}
      }
    },
    "fpgas": {
      "type": "array",
      "minItems": 1,
      "items": {
        "type": "object",
        "required": ["id", "part", "capacity", "utilization_limit"]
      }
    },
    "links": {
      "type": "array",
      "items": {
        "type": "object",
        "required": [
          "id",
          "endpoints",
          "direction",
          "mode",
          "data_lanes_per_direction",
          "fabric_clock_mhz",
          "latency_cycles"
        ]
      }
    }
  },
  "additionalProperties": true
}
