{
  "schema": "emuflow.boarddb/v1",
  "platform": {
    "name": "virtual_xcvu3p_8fpga_mesh",
    "kind": "virtual",
    "description": "Board-independent 2x4 mesh for million-cell scale validation"
  },
  "fpgas": [
    {
      "id": "fpga0",
      "part": "xcvu3p-ffvc1517-2-e",
      "utilization_limit": 0.75,
      "capacity": {
        "lut": 394080,
        "ff": 788160,
        "bram18k": 1440,
        "uram288": 320,
        "dsp48": 2280
      }
    },
    {
      "id": "fpga1",
      "part": "xcvu3p-ffvc1517-2-e",
      "utilization_limit": 0.75,
      "capacity": {
        "lut": 394080,
        "ff": 788160,
        "bram18k": 1440,
        "uram288": 320,
        "dsp48": 2280
      }
    },
    {
      "id": "fpga2",
      "part": "xcvu3p-ffvc1517-2-e",
      "utilization_limit": 0.75,
      "capacity": {
        "lut": 394080,
        "ff": 788160,
        "bram18k": 1440,
        "uram288": 320,
        "dsp48": 2280
      }
    },
    {
      "id": "fpga3",
      "part": "xcvu3p-ffvc1517-2-e",
      "utilization_limit": 0.75,
      "capacity": {
        "lut": 394080,
        "ff": 788160,
        "bram18k": 1440,
        "uram288": 320,
        "dsp48": 2280
      }
    },
    {
      "id": "fpga4",
      "part": "xcvu3p-ffvc1517-2-e",
      "utilization_limit": 0.75,
      "capacity": {
        "lut": 394080,
        "ff": 788160,
        "bram18k": 1440,
        "uram288": 320,
        "dsp48": 2280
      }
    },
    {
      "id": "fpga5",
      "part": "xcvu3p-ffvc1517-2-e",
      "utilization_limit": 0.75,
      "capacity": {
        "lut": 394080,
        "ff": 788160,
        "bram18k": 1440,
        "uram288": 320,
        "dsp48": 2280
      }
    },
    {
      "id": "fpga6",
      "part": "xcvu3p-ffvc1517-2-e",
      "utilization_limit": 0.75,
      "capacity": {
        "lut": 394080,
        "ff": 788160,
        "bram18k": 1440,
        "uram288": 320,
        "dsp48": 2280
      }
    },
    {
      "id": "fpga7",
      "part": "xcvu3p-ffvc1517-2-e",
      "utilization_limit": 0.75,
      "capacity": {
        "lut": 394080,
        "ff": 788160,
        "bram18k": 1440,
        "uram288": 320,
        "dsp48": 2280
      }
    }
  ],
  "links": [
    {
      "id": "link_0_1",
      "endpoints": ["fpga0", "fpga1"],
      "direction": "full_duplex",
      "mode": "source_synchronous",
      "data_lanes_per_direction": 32,
      "fabric_clock_mhz": 250.0,
      "latency_cycles": 2
    },
    {
      "id": "link_1_2",
      "endpoints": ["fpga1", "fpga2"],
      "direction": "full_duplex",
      "mode": "source_synchronous",
      "data_lanes_per_direction": 32,
      "fabric_clock_mhz": 250.0,
      "latency_cycles": 2
    },
    {
      "id": "link_2_3",
      "endpoints": ["fpga2", "fpga3"],
      "direction": "full_duplex",
      "mode": "source_synchronous",
      "data_lanes_per_direction": 32,
      "fabric_clock_mhz": 250.0,
      "latency_cycles": 2
    },
    {
      "id": "link_4_5",
      "endpoints": ["fpga4", "fpga5"],
      "direction": "full_duplex",
      "mode": "source_synchronous",
      "data_lanes_per_direction": 32,
      "fabric_clock_mhz": 250.0,
      "latency_cycles": 2
    },
    {
      "id": "link_5_6",
      "endpoints": ["fpga5", "fpga6"],
      "direction": "full_duplex",
      "mode": "source_synchronous",
      "data_lanes_per_direction": 32,
      "fabric_clock_mhz": 250.0,
      "latency_cycles": 2
    },
    {
      "id": "link_6_7",
      "endpoints": ["fpga6", "fpga7"],
      "direction": "full_duplex",
      "mode": "source_synchronous",
      "data_lanes_per_direction": 32,
      "fabric_clock_mhz": 250.0,
      "latency_cycles": 2
    },
    {
      "id": "link_0_4",
      "endpoints": ["fpga0", "fpga4"],
      "direction": "full_duplex",
      "mode": "source_synchronous",
      "data_lanes_per_direction": 32,
      "fabric_clock_mhz": 250.0,
      "latency_cycles": 2
    },
    {
      "id": "link_1_5",
      "endpoints": ["fpga1", "fpga5"],
      "direction": "full_duplex",
      "mode": "source_synchronous",
      "data_lanes_per_direction": 32,
      "fabric_clock_mhz": 250.0,
      "latency_cycles": 2
    },
    {
      "id": "link_2_6",
      "endpoints": ["fpga2", "fpga6"],
      "direction": "full_duplex",
      "mode": "source_synchronous",
      "data_lanes_per_direction": 32,
      "fabric_clock_mhz": 250.0,
      "latency_cycles": 2
    },
    {
      "id": "link_3_7",
      "endpoints": ["fpga3", "fpga7"],
      "direction": "full_duplex",
      "mode": "source_synchronous",
      "data_lanes_per_direction": 32,
      "fabric_clock_mhz": 250.0,
      "latency_cycles": 2
    }
  ]
}
