{
  "schema": "emuflow.boarddb/v1",
  "platform": {
    "name": "virtual_xcvu9p_4fpga_mesh",
    "kind": "virtual",
    "description": "Board-independent 2x2 VU9P mesh with 25% implementation headroom"
  },
  "fpgas": [
    {
      "id": "fpga0",
      "part": "xcvu9p-flga2104-2L-e",
      "utilization_limit": 0.75,
      "capacity": {
        "lut": 1182240,
        "ff": 2364480,
        "bram18k": 4320,
        "uram288": 960,
        "dsp48": 6840
      }
    },
    {
      "id": "fpga1",
      "part": "xcvu9p-flga2104-2L-e",
      "utilization_limit": 0.75,
      "capacity": {
        "lut": 1182240,
        "ff": 2364480,
        "bram18k": 4320,
        "uram288": 960,
        "dsp48": 6840
      }
    },
    {
      "id": "fpga2",
      "part": "xcvu9p-flga2104-2L-e",
      "utilization_limit": 0.75,
      "capacity": {
        "lut": 1182240,
        "ff": 2364480,
        "bram18k": 4320,
        "uram288": 960,
        "dsp48": 6840
      }
    },
    {
      "id": "fpga3",
      "part": "xcvu9p-flga2104-2L-e",
      "utilization_limit": 0.75,
      "capacity": {
        "lut": 1182240,
        "ff": 2364480,
        "bram18k": 4320,
        "uram288": 960,
        "dsp48": 6840
      }
    }
  ],
  "links": [
    {
      "id": "link_0_1",
      "endpoints": ["fpga0", "fpga1"],
      "direction": "full_duplex",
      "mode": "source_synchronous",
      "data_lanes_per_direction": 32,
      "fabric_clock_mhz": 250.0,
      "latency_cycles": 2
    },
    {
      "id": "link_2_3",
      "endpoints": ["fpga2", "fpga3"],
      "direction": "full_duplex",
      "mode": "source_synchronous",
      "data_lanes_per_direction": 32,
      "fabric_clock_mhz": 250.0,
      "latency_cycles": 2
    },
    {
      "id": "link_0_2",
      "endpoints": ["fpga0", "fpga2"],
      "direction": "full_duplex",
      "mode": "source_synchronous",
      "data_lanes_per_direction": 32,
      "fabric_clock_mhz": 250.0,
      "latency_cycles": 2
    },
    {
      "id": "link_1_3",
      "endpoints": ["fpga1", "fpga3"],
      "direction": "full_duplex",
      "mode": "source_synchronous",
      "data_lanes_per_direction": 32,
      "fabric_clock_mhz": 250.0,
      "latency_cycles": 2
    }
  ]
}
